{
  "manifest_version": 1,
  "country_iso3": "COD",
  "reviewed_at": "2026-10-05",
  "sources": [
    {
      "id": "ocha-rgc-cod-adm1-2017",
      "admin_level": "ADM1",
      "canonical_name": "Provinces",
      "boundary_year": 2017,
      "provider": "World Bank Data Catalog mirror",
      "source_organizations": ["OCHA DR Congo", "Référentiel Géographique Commun"],
      "licence": {
        "name": "Creative Commons Attribution 4.0 International",
        "url": "https://creativecommons.org/licenses/by/4.0/",
        "attribution": "OCHA DR Congo and Référentiel Géographique Commun; distributed by the World Bank Data Catalog."
      },
      "metadata_url": "https://energydata.info/dataset/democratic-republic-congo-administrative-boundaries-2017",
      "download_url": "https://datacatalogfiles.worldbank.org/ddh-published/0040240/1/DR0050122/codadmbndaadm120170407.geojson",
      "source_revision": "0040240-v1-dr0050122",
      "sha256": "123f137e25a64a1a2585129751ab799c5a83488f319c8de09a9a006d68e3e82a",
      "feature_count": 26,
      "geometry_types": ["Polygon"],
      "fields": {
        "id": "PCode",
        "name": "NOM",
        "code": "PCode"
      },
      "preprocessing": ["strip-trailing-system-io-memorystream"],
      "source_updated_at": "2017-04-07",
      "built_at": "2017-04-07",
      "review_status": "source-checked",
      "geometry_review": "topology-reviewed",
      "intended_use": "Province navigation and administrative context; never a language boundary.",
      "limitations": [
        "The represented boundary year is 2017 and must not be described as a current legal boundary without renewed review.",
        "The distributor appends a non-JSON System.IO.MemoryStream marker, which the build removes only after verifying the raw-file checksum.",
        "Names require comparison with current authoritative DRC records before public release."
      ]
    },
    {
      "id": "ocha-rgc-cod-adm2-2017",
      "admin_level": "ADM2",
      "canonical_name": "Territories, cities, and communes",
      "boundary_year": 2017,
      "provider": "World Bank Data Catalog mirror",
      "source_organizations": ["OCHA DR Congo", "Référentiel Géographique Commun"],
      "licence": {
        "name": "Creative Commons Attribution 4.0 International",
        "url": "https://creativecommons.org/licenses/by/4.0/",
        "attribution": "OCHA DR Congo and Référentiel Géographique Commun; distributed by the World Bank Data Catalog."
      },
      "metadata_url": "https://energydata.info/dataset/democratic-republic-congo-administrative-boundaries-2017",
      "download_url": "https://datacatalogfiles.worldbank.org/ddh-published/0040240/1/DR0050124/codadmbndaadm2rgc20170711.geojson",
      "source_revision": "0040240-v1-dr0050124",
      "sha256": "66eac533de0c7cb946d5b8fcc1b7d7f63d54c10c3e57454dc8f602308917e76d",
      "feature_count": 240,
      "geometry_types": ["Polygon"],
      "fields": {
        "id": "ADM2_PCODE",
        "name": "ADM2_FR",
        "code": "ADM2_PCODE",
        "parent_code": "ADM1_PCODE"
      },
      "preprocessing": ["strip-trailing-system-io-memorystream"],
      "source_updated_at": "2017-07-11",
      "built_at": "2017-07-11",
      "review_status": "source-checked",
      "geometry_review": "topology-reviewed",
      "intended_use": "Second-level navigation and administrative context; never a language boundary.",
      "limitations": [
        "The layer includes territories, cities, and communes and must not be presented as a territory-only inventory.",
        "The represented boundary year is 2017 and requires renewed administrative review before public release.",
        "The distributor appends a non-JSON System.IO.MemoryStream marker, which the build removes only after verifying the raw-file checksum."
      ]
    }
  ]
}
